{
  "$schema": "https://json-schema.org/draft/2020-12/schema",
  "title": "Fish species",
  "description": "One aquarium fish species. Metric units only. Use null when a value is not known with certainty; never a guess.",
  "type": "object",
  "additionalProperties": false,
  "required": [
    "$schema",
    "id",
    "scientific_name",
    "common_names",
    "water_type",
    "adult_size_cm",
    "min_tank_liters",
    "temperature_c",
    "ph",
    "temperament",
    "swim_zone",
    "diet",
    "care_level",
    "sources",
    "status"
  ],
  "properties": {
    "$schema": {
      "description": "Points editors to this schema for autocompletion. Always ../../schema/fish.schema.json.",
      "const": "../../schema/fish.schema.json"
    },
    "id": {
      "description": "Scientific name in kebab-case, without accents. Also the file name: fish/<genus>/<id>.json.",
      "type": "string",
      "pattern": "^[a-z0-9]+(-[a-z0-9]+)+$"
    },
    "scientific_name": {
      "description": "Scientific name, e.g. \"Paracheirodon innesi\".",
      "type": "string",
      "minLength": 1
    },
    "common_names": {
      "description": "Common names by language.",
      "type": "object",
      "additionalProperties": false,
      "required": ["es"],
      "properties": {
        "es": {
          "description": "Spanish common names (at least one).",
          "$ref": "#/$defs/nameList",
          "minItems": 1
        },
        "en": {
          "description": "English common names.",
          "$ref": "#/$defs/nameList"
        }
      }
    },
    "family": {
      "description": "Taxonomic family, e.g. \"Characidae\".",
      "type": ["string", "null"],
      "minLength": 1
    },
    "water_type": {
      "description": "Water the species lives in.",
      "enum": ["freshwater", "brackish", "marine"]
    },
    "adult_size_cm": {
      "description": "Typical adult length in centimeters.",
      "$ref": "#/$defs/positiveNumber"
    },
    "min_tank_liters": {
      "description": "Minimum tank volume in liters.",
      "$ref": "#/$defs/positiveNumber"
    },
    "temperature_c": {
      "description": "Temperature range in °C, e.g. { \"min\": 22, \"max\": 26 }.",
      "$ref": "#/$defs/nullableRange"
    },
    "ph": {
      "description": "pH range, e.g. { \"min\": 6.0, \"max\": 7.5 }.",
      "$ref": "#/$defs/nullableRange"
    },
    "hardness_dgh": {
      "description": "General hardness range in °dH (optional).",
      "$ref": "#/$defs/nullableRange"
    },
    "temperament": {
      "description": "Behavior toward other fish.",
      "enum": ["peaceful", "semi_aggressive", "aggressive", null]
    },
    "swim_zone": {
      "description": "Part of the tank where it usually swims.",
      "enum": ["top", "middle", "bottom", "all", null]
    },
    "schooling_min": {
      "description": "Minimum group size. null if the species does not live in groups.",
      "type": ["integer", "null"],
      "minimum": 2
    },
    "diet": {
      "description": "Main diet.",
      "enum": ["herbivore", "carnivore", "omnivore", null]
    },
    "care_level": {
      "description": "Experience needed to keep it.",
      "enum": ["beginner", "intermediate", "advanced", null]
    },
    "notes": {
      "description": "Short original text, in English. Never copied.",
      "type": ["string", "null"]
    },
    "sources": {
      "description": "Where the data comes from. At least one is required for status reviewed.",
      "type": "array",
      "items": { "type": "string", "minLength": 1 }
    },
    "status": {
      "description": "draft = not reviewed. reviewed = verified by a human, with sources. Only a human sets reviewed.",
      "enum": ["draft", "reviewed"]
    }
  },
  "$defs": {
    "nameList": {
      "type": "array",
      "items": { "type": "string", "minLength": 1 }
    },
    "positiveNumber": {
      "type": ["number", "null"],
      "exclusiveMinimum": 0
    },
    "nullableRange": {
      "description": "A { min, max } range, or null when unknown.",
      "type": ["object", "null"],
      "additionalProperties": false,
      "required": ["min", "max"],
      "properties": {
        "min": { "type": "number" },
        "max": { "type": "number" }
      }
    }
  }
}
