{
  "$schema": "../../schema/fish.schema.json",
  "id": "monocirrhus-polyacanthus",
  "scientific_name": "Monocirrhus polyacanthus",
  "common_names": {
    "es": ["Monocirrhus polyacanthus"],
    "en": ["South American Leaf Fish"]
  },
  "family": "Polycentridae",
  "water_type": "freshwater",
  "adult_size_cm": 10,
  "min_tank_liters": 68,
  "temperature_c": {
    "min": 23,
    "max": 29
  },
  "ph": {
    "min": 5,
    "max": 6.8
  },
  "hardness_dgh": {
    "min": 1,
    "max": 10
  },
  "temperament": "semi_aggressive",
  "swim_zone": null,
  "schooling_min": null,
  "diet": "carnivore",
  "care_level": "intermediate",
  "notes": null,
  "sources": [
    "https://www.seriouslyfish.com/species/monocirrhus-polyacanthus/"
  ],
  "status": "draft"
}
