{
  "$schema": "../../schema/fish.schema.json",
  "id": "maylandia-lombardoi",
  "scientific_name": "Maylandia lombardoi",
  "common_names": {
    "es": ["Maylandia lombardoi"],
    "en": ["Kennyi"]
  },
  "family": "Cichlidae",
  "water_type": "freshwater",
  "adult_size_cm": 15,
  "min_tank_liters": 205,
  "temperature_c": {
    "min": 24,
    "max": 28
  },
  "ph": {
    "min": 7.6,
    "max": 8.8
  },
  "hardness_dgh": {
    "min": 10,
    "max": 25
  },
  "temperament": "semi_aggressive",
  "swim_zone": null,
  "schooling_min": null,
  "diet": "herbivore",
  "care_level": "intermediate",
  "notes": null,
  "sources": ["https://www.seriouslyfish.com/species/maylandia-lombardoi/"],
  "status": "draft"
}
