{
  "$schema": "../../schema/fish.schema.json",
  "id": "anomalochromis-thomasi",
  "scientific_name": "Anomalochromis thomasi",
  "common_names": {
    "es": ["Cíclido Mariposa Africana"],
    "en": []
  },
  "family": "Cichlidae",
  "water_type": "freshwater",
  "adult_size_cm": 9,
  "min_tank_liters": 100,
  "temperature_c": {
    "min": 23,
    "max": 29
  },
  "ph": {
    "min": 6,
    "max": 7.5
  },
  "hardness_dgh": {
    "min": 5,
    "max": 10
  },
  "temperament": "peaceful",
  "swim_zone": "middle",
  "schooling_min": null,
  "diet": "omnivore",
  "care_level": "intermediate",
  "notes": null,
  "sources": [],
  "status": "draft"
}
