{
  "$schema": "../../schema/fish.schema.json",
  "id": "enteromius-fasciolatus",
  "scientific_name": "Enteromius fasciolatus",
  "common_names": {
    "es": ["Enteromius fasciolatus"],
    "en": ["African Banded Barb"]
  },
  "family": "Cyprinidae",
  "water_type": "freshwater",
  "adult_size_cm": 6,
  "min_tank_liters": 68,
  "temperature_c": {
    "min": 20,
    "max": 26
  },
  "ph": {
    "min": 5,
    "max": 6.5
  },
  "hardness_dgh": {
    "min": 1,
    "max": 12
  },
  "temperament": "peaceful",
  "swim_zone": null,
  "schooling_min": 8,
  "diet": "omnivore",
  "care_level": "beginner",
  "notes": null,
  "sources": ["https://www.seriouslyfish.com/species/enteromius-fasciolatus/"],
  "status": "draft"
}
