{
  "$schema": "../../schema/fish.schema.json",
  "id": "epalzeorhynchos-frenatum",
  "scientific_name": "Epalzeorhynchos frenatum",
  "common_names": {
    "es": ["Labeo Frenatus", "Labeo Verde", "Tiburón de Aletas Rojas"],
    "en": ["Rainbow shark"]
  },
  "family": "Cyprinidae",
  "water_type": "freshwater",
  "adult_size_cm": 16,
  "min_tank_liters": 150,
  "temperature_c": null,
  "ph": {
    "min": 6.2,
    "max": 7.5
  },
  "hardness_dgh": {
    "min": 8,
    "max": 11
  },
  "temperament": "aggressive",
  "swim_zone": null,
  "schooling_min": null,
  "diet": "omnivore",
  "care_level": "intermediate",
  "notes": null,
  "sources": [],
  "status": "draft"
}
