{
  "$schema": "../../schema/fish.schema.json",
  "id": "megalechis-thoracata",
  "scientific_name": "Megalechis thoracata",
  "common_names": {
    "es": ["Megalechis thoracata"],
    "en": ["Spotted Hoplo"]
  },
  "family": "Callichthyidae",
  "water_type": "freshwater",
  "adult_size_cm": 15,
  "min_tank_liters": 137,
  "temperature_c": {
    "min": 18,
    "max": 28
  },
  "ph": {
    "min": 6,
    "max": 8
  },
  "hardness_dgh": {
    "min": 0,
    "max": 20
  },
  "temperament": "peaceful",
  "swim_zone": null,
  "schooling_min": null,
  "diet": null,
  "care_level": "beginner",
  "notes": null,
  "sources": ["https://www.seriouslyfish.com/species/megalechis-thoracata/"],
  "status": "draft"
}
