{
  "$schema": "../../schema/fish.schema.json",
  "id": "pterophyllum-scalare",
  "scientific_name": "Pterophyllum scalare",
  "common_names": {
    "es": ["Escalar", "Pez Ángel"],
    "en": ["Freshwater angelfish"]
  },
  "family": "Cichlidae",
  "water_type": "freshwater",
  "adult_size_cm": 15,
  "min_tank_liters": 40,
  "temperature_c": {
    "min": 24,
    "max": 28
  },
  "ph": {
    "min": 6,
    "max": 7
  },
  "hardness_dgh": {
    "min": 2,
    "max": 10
  },
  "temperament": "semi_aggressive",
  "swim_zone": null,
  "schooling_min": 4,
  "diet": "omnivore",
  "care_level": "intermediate",
  "notes": null,
  "sources": [],
  "status": "draft"
}
