{
  "$schema": "../../schema/fish.schema.json",
  "id": "telmatochromis-vittatus",
  "scientific_name": "Telmatochromis vittatus",
  "common_names": {
    "es": ["Telmatochromis vittatus"],
    "en": []
  },
  "family": "Cichlidae",
  "water_type": "freshwater",
  "adult_size_cm": 8.5,
  "min_tank_liters": 68,
  "temperature_c": {
    "min": 23,
    "max": 27
  },
  "ph": {
    "min": 8,
    "max": 9.5
  },
  "hardness_dgh": {
    "min": 8,
    "max": 25
  },
  "temperament": "semi_aggressive",
  "swim_zone": null,
  "schooling_min": null,
  "diet": null,
  "care_level": "intermediate",
  "notes": null,
  "sources": ["https://www.seriouslyfish.com/species/telmatochromis-vittatus/"],
  "status": "draft"
}
