{
  "$schema": "../../schema/fish.schema.json",
  "id": "corydoras-reticulatus",
  "scientific_name": "Corydoras reticulatus",
  "common_names": {
    "es": ["Corydoras reticulatus"],
    "en": ["Reticulated Cory"]
  },
  "family": "Callichthyidae",
  "water_type": "freshwater",
  "adult_size_cm": 6,
  "min_tank_liters": 68,
  "temperature_c": {
    "min": 22,
    "max": 26
  },
  "ph": {
    "min": 6,
    "max": 7.2
  },
  "hardness_dgh": {
    "min": 2,
    "max": 15
  },
  "temperament": "peaceful",
  "swim_zone": null,
  "schooling_min": 6,
  "diet": "carnivore",
  "care_level": "beginner",
  "notes": "Placed in Brochis reticulata by a recent revision; kept under Corydoras for now to match the rest of the dataset.",
  "sources": ["https://www.seriouslyfish.com/species/brochis-reticulata/"],
  "status": "draft"
}
