{
  "$schema": "../../schema/fish.schema.json",
  "id": "corydoras-panda",
  "scientific_name": "Corydoras panda",
  "common_names": {
    "es": ["Coridora Panda"],
    "en": ["Panda corydoras"]
  },
  "family": "Callichthyidae",
  "water_type": "freshwater",
  "adult_size_cm": 5,
  "min_tank_liters": 40,
  "temperature_c": {
    "min": 20,
    "max": 26
  },
  "ph": {
    "min": 6,
    "max": 7.5
  },
  "hardness_dgh": {
    "min": 2,
    "max": 12
  },
  "temperament": "peaceful",
  "swim_zone": "bottom",
  "schooling_min": 4,
  "diet": "omnivore",
  "care_level": "beginner",
  "notes": null,
  "sources": [],
  "status": "draft"
}
