{
  "$schema": "../../schema/fish.schema.json",
  "id": "geophagus-steindachneri",
  "scientific_name": "'Geophagus' steindachneri",
  "common_names": {
    "es": ["'Geophagus' steindachneri"],
    "en": ["Red Hump Eartheater"]
  },
  "family": "Cichlidae",
  "water_type": "freshwater",
  "adult_size_cm": 15,
  "min_tank_liters": 243,
  "temperature_c": {
    "min": 20,
    "max": 30
  },
  "ph": {
    "min": 6,
    "max": 7.5
  },
  "hardness_dgh": {
    "min": 2,
    "max": 12
  },
  "temperament": "semi_aggressive",
  "swim_zone": null,
  "schooling_min": null,
  "diet": null,
  "care_level": "intermediate",
  "notes": null,
  "sources": ["https://www.seriouslyfish.com/species/geophagus-steindachneri/"],
  "status": "draft"
}
