{
  "$schema": "../../schema/fish.schema.json",
  "id": "pangio-myersi",
  "scientific_name": "Pangio myersi",
  "common_names": {
    "es": ["Pangio myersi"],
    "en": ["Giant Kuhli Loach"]
  },
  "family": "Cobitidae",
  "water_type": "freshwater",
  "adult_size_cm": 10,
  "min_tank_liters": 54,
  "temperature_c": {
    "min": 21,
    "max": 26
  },
  "ph": {
    "min": 3.5,
    "max": 7
  },
  "hardness_dgh": {
    "min": 0,
    "max": 8
  },
  "temperament": null,
  "swim_zone": null,
  "schooling_min": 5,
  "diet": "carnivore",
  "care_level": "beginner",
  "notes": null,
  "sources": ["https://www.seriouslyfish.com/species/pangio-myersi/"],
  "status": "draft"
}
