{
  "$schema": "../../schema/fish.schema.json",
  "id": "hypancistrus-zebra",
  "scientific_name": "Hypancistrus zebra",
  "common_names": {
    "es": ["Hypancistrus zebra"],
    "en": ["Zebra Plec"]
  },
  "family": "Loricariidae",
  "water_type": "freshwater",
  "adult_size_cm": 8,
  "min_tank_liters": 54,
  "temperature_c": {
    "min": 26,
    "max": 30
  },
  "ph": {
    "min": 6,
    "max": 7.5
  },
  "hardness_dgh": {
    "min": 2,
    "max": 15
  },
  "temperament": "semi_aggressive",
  "swim_zone": null,
  "schooling_min": null,
  "diet": "carnivore",
  "care_level": "intermediate",
  "notes": null,
  "sources": ["https://www.seriouslyfish.com/species/hypancistrus-zebra/"],
  "status": "draft"
}
