{
  "$schema": "../../schema/fish.schema.json",
  "id": "aulonocara-maylandi",
  "scientific_name": "Aulonocara maylandi",
  "common_names": {
    "es": ["Aulonocara maylandi"],
    "en": ["Sulphurhead Peacock"]
  },
  "family": "Cichlidae",
  "water_type": "freshwater",
  "adult_size_cm": 10,
  "min_tank_liters": 108,
  "temperature_c": {
    "min": 25,
    "max": 29
  },
  "ph": {
    "min": 7.5,
    "max": 9
  },
  "hardness_dgh": {
    "min": 10,
    "max": 25
  },
  "temperament": null,
  "swim_zone": null,
  "schooling_min": null,
  "diet": null,
  "care_level": "intermediate",
  "notes": null,
  "sources": ["https://www.seriouslyfish.com/species/aulonocara-maylandi/"],
  "status": "draft"
}
