{
  "$schema": "../../schema/fish.schema.json",
  "id": "abramites-hypselonotus",
  "scientific_name": "Abramites hypselonotus",
  "common_names": {
    "es": ["Abramites hypselonotus"],
    "en": ["Marbled Headstander"]
  },
  "family": "Anostomidae",
  "water_type": "freshwater",
  "adult_size_cm": 14,
  "min_tank_liters": 108,
  "temperature_c": {
    "min": 20,
    "max": 30
  },
  "ph": {
    "min": 5.5,
    "max": 7.5
  },
  "hardness_dgh": {
    "min": 1,
    "max": 15
  },
  "temperament": null,
  "swim_zone": null,
  "schooling_min": null,
  "diet": "omnivore",
  "care_level": "beginner",
  "notes": null,
  "sources": ["https://www.seriouslyfish.com/species/abramites-hypselonotus/"],
  "status": "draft"
}
